author_id,name,bio
1,Alan Dominguez,"Kitchen pretty even record present beat with practice. High once eight strong.
Agency break job peace daughter but. Free recognize pretty others left. About meet behind total executive operation."
2,Linda Ford,"Worry chair next once leave our third participant.
Her remember career executive maintain professional. Church management expect whether blood table ground."
3,Steven Alvarez,Heavy administration class somebody personal relate. Sell young within teach mind family make. Economy how skill box crime.
4,Mariah Flores,"Figure over need return while admit recently measure. Manage sing its.
Involve truth be responsibility service story really."
5,Brett George,Woman professor minute poor brother. Among watch of feel cup own. Success draw seek visit people actually.
6,Paul Spencer,"Election soon eight soon animal major plant. Mother race medical hot. Technology color laugh rise.
Stuff cut still attorney ability. According range everyone interview direction wrong city."
7,Crystal Ibarra,"Mention girl society local market foot hope. Appear bad sign rate less bit continue.
Paper central society. Individual health rather.
Learn full main."
8,Kelly Hodge,Itself agent how debate quite in whatever. May east letter must. Join party drive half hair might box.
9,Gregory Berry,When so each young national finish available. Assume group interesting always return spend send soon.
10,Lisa Moran,"Person fear pressure boy. Land view night I poor.
Later training evening individual analysis subject. Really item pay house kind along. Possible expert of finally position doctor when."
11,Russell Jones,"Congress many film. Relationship while happen base.
Site apply hour report. Social card we role break available over. Interview set or free development."
12,Michael Powell,Least significant how present big now outside. No deep every within.
13,Aaron Mendoza,"Travel study must easy young measure beat. Mission coach special wind million poor capital. Mother say soon within mention.
Ground him consumer write ahead let record heavy. Mrs pass certain nature."
14,James Brewer,"Arm give talk doctor seven team program must. Difficult culture choice memory.
Have treat nice claim blue. Control system another suggest strategy. Can force charge rather within natural."
15,Melissa May,Just result significant happy find difference. Board none yes data work. Any check toward support on top. You road wind red own seek where unit.
16,Gregory Palmer,Actually conference society season never simply. New set population miss bring. Night what best nothing.
17,Sonya Shepard,"Into color may force. Not story product just. Final major enjoy ok.
Will material when fine man few resource interesting. Bring measure mind what. Push paper nation start face without."
18,Margaret Moyer,"Trade case wife industry plan again least. Above wind Mr popular.
Anyone lead nothing social order stay represent. Different ready century action town try only."
19,Christopher Williams,"Apply several also forward.
Blood agency foot. Plan try test office security. Early never expert material vote idea.
Car truth spend board reflect seem late. Despite leave society force him run."
20,Bryan Fry,Investment front about all. Understand region court particular huge too race well. Risk effect although half mission church.
